{
  "$schema": "./rls_snapshot.schema.json",
  "description": "Expected end-state of RLS policies, storage bucket visibility, and security triggers after applying every migration in supabase/migrations. Regenerate with `node scripts/check-rls.mjs --update-snapshot` after an intentional, reviewed policy change.",
  "policies": {
    "public.bookmarks": [
      {
        "name": "Users can delete own bookmarks",
        "cmd": "delete",
        "roles": [
          "public"
        ],
        "permissive": "permissive",
        "using": "auth.uid()=user_id",
        "with_check": null
      },
      {
        "name": "Authenticated users can insert bookmarks",
        "cmd": "insert",
        "roles": [
          "public"
        ],
        "permissive": "permissive",
        "using": null,
        "with_check": "auth.uid()=user_id"
      },
      {
        "name": "Users can view own bookmarks",
        "cmd": "select",
        "roles": [
          "public"
        ],
        "permissive": "permissive",
        "using": "auth.uid()=user_id",
        "with_check": null
      }
    ],
    "public.comments": [
      {
        "name": "Users can delete own comments",
        "cmd": "delete",
        "roles": [
          "public"
        ],
        "permissive": "permissive",
        "using": "auth.uid()=user_id",
        "with_check": null
      },
      {
        "name": "Users can comment on visible posts",
        "cmd": "insert",
        "roles": [
          "public"
        ],
        "permissive": "permissive",
        "using": null,
        "with_check": "(auth.uid()=user_id)and can_view_post(post_id)"
      },
      {
        "name": "Users can view comments on visible posts",
        "cmd": "select",
        "roles": [
          "public"
        ],
        "permissive": "permissive",
        "using": "can_view_post(post_id)",
        "with_check": null
      }
    ],
    "public.conversation_participants": [
      {
        "name": "Users can leave conversations",
        "cmd": "delete",
        "roles": [
          "public"
        ],
        "permissive": "permissive",
        "using": "auth.uid()=user_id",
        "with_check": null
      },
      {
        "name": "Users can add conversation participants",
        "cmd": "insert",
        "roles": [
          "public"
        ],
        "permissive": "permissive",
        "using": null,
        "with_check": "(auth.uid()is not null)and((user_id=auth.uid())or is_conversation_participant(conversation_id))"
      },
      {
        "name": "Participants can view conversation members",
        "cmd": "select",
        "roles": [
          "public"
        ],
        "permissive": "permissive",
        "using": "is_conversation_participant(conversation_id)",
        "with_check": null
      }
    ],
    "public.conversations": [
      {
        "name": "Authenticated users can create conversations",
        "cmd": "insert",
        "roles": [
          "public"
        ],
        "permissive": "permissive",
        "using": null,
        "with_check": "auth.uid()is not null"
      },
      {
        "name": "Participants can view conversations",
        "cmd": "select",
        "roles": [
          "public"
        ],
        "permissive": "permissive",
        "using": "is_conversation_participant(id)",
        "with_check": null
      }
    ],
    "public.follows": [
      {
        "name": "Users can delete own follows",
        "cmd": "delete",
        "roles": [
          "public"
        ],
        "permissive": "permissive",
        "using": "auth.uid()=follower_id",
        "with_check": null
      },
      {
        "name": "Authenticated users can insert follows",
        "cmd": "insert",
        "roles": [
          "public"
        ],
        "permissive": "permissive",
        "using": null,
        "with_check": "auth.uid()=follower_id"
      },
      {
        "name": "Anyone can view follows",
        "cmd": "select",
        "roles": [
          "public"
        ],
        "permissive": "permissive",
        "using": "true",
        "with_check": null
      }
    ],
    "public.likes": [
      {
        "name": "Users can delete own likes",
        "cmd": "delete",
        "roles": [
          "public"
        ],
        "permissive": "permissive",
        "using": "auth.uid()=user_id",
        "with_check": null
      },
      {
        "name": "Users can like visible posts",
        "cmd": "insert",
        "roles": [
          "public"
        ],
        "permissive": "permissive",
        "using": null,
        "with_check": "(auth.uid()=user_id)and can_view_post(post_id)"
      },
      {
        "name": "Users can view likes on visible posts",
        "cmd": "select",
        "roles": [
          "public"
        ],
        "permissive": "permissive",
        "using": "can_view_post(post_id)",
        "with_check": null
      }
    ],
    "public.messages": [
      {
        "name": "Participants can send messages",
        "cmd": "insert",
        "roles": [
          "public"
        ],
        "permissive": "permissive",
        "using": null,
        "with_check": "(auth.uid()=sender_id)and is_conversation_participant(conversation_id)"
      },
      {
        "name": "Participants can view messages",
        "cmd": "select",
        "roles": [
          "public"
        ],
        "permissive": "permissive",
        "using": "is_conversation_participant(conversation_id)",
        "with_check": null
      },
      {
        "name": "Participants can update messages",
        "cmd": "update",
        "roles": [
          "public"
        ],
        "permissive": "permissive",
        "using": "is_conversation_participant(conversation_id)",
        "with_check": "is_conversation_participant(conversation_id)"
      }
    ],
    "public.music_tracks": [
      {
        "name": "Service role can write music tracks",
        "cmd": "all",
        "roles": [
          "service_role"
        ],
        "permissive": "permissive",
        "using": "true",
        "with_check": "true"
      },
      {
        "name": "Anyone can read music tracks",
        "cmd": "select",
        "roles": [
          "public"
        ],
        "permissive": "permissive",
        "using": "true",
        "with_check": null
      },
      {
        "name": "Authenticated users can read music tracks",
        "cmd": "select",
        "roles": [
          "authenticated"
        ],
        "permissive": "permissive",
        "using": "true",
        "with_check": null
      }
    ],
    "public.notification_preferences": [
      {
        "name": "Users can create own notification preferences",
        "cmd": "insert",
        "roles": [
          "public"
        ],
        "permissive": "permissive",
        "using": null,
        "with_check": "auth.uid()=user_id"
      },
      {
        "name": "Users can view own notification preferences",
        "cmd": "select",
        "roles": [
          "public"
        ],
        "permissive": "permissive",
        "using": "auth.uid()=user_id",
        "with_check": null
      },
      {
        "name": "Users can update own notification preferences",
        "cmd": "update",
        "roles": [
          "public"
        ],
        "permissive": "permissive",
        "using": "auth.uid()=user_id",
        "with_check": "auth.uid()=user_id"
      }
    ],
    "public.notifications": [
      {
        "name": "Users can delete own notifications",
        "cmd": "delete",
        "roles": [
          "public"
        ],
        "permissive": "permissive",
        "using": "auth.uid()=user_id",
        "with_check": null
      },
      {
        "name": "Users can view own notifications",
        "cmd": "select",
        "roles": [
          "public"
        ],
        "permissive": "permissive",
        "using": "auth.uid()=user_id",
        "with_check": null
      },
      {
        "name": "Users can update own notifications",
        "cmd": "update",
        "roles": [
          "public"
        ],
        "permissive": "permissive",
        "using": "auth.uid()=user_id",
        "with_check": null
      }
    ],
    "public.posts": [
      {
        "name": "Users can delete own posts",
        "cmd": "delete",
        "roles": [
          "public"
        ],
        "permissive": "permissive",
        "using": "auth.uid()=user_id",
        "with_check": null
      },
      {
        "name": "Authenticated users can insert their own posts",
        "cmd": "insert",
        "roles": [
          "authenticated"
        ],
        "permissive": "permissive",
        "using": null,
        "with_check": "auth.uid()=user_id"
      },
      {
        "name": "Users can view visible posts",
        "cmd": "select",
        "roles": [
          "public"
        ],
        "permissive": "permissive",
        "using": "(auth.uid()=user_id)or can_view_post(id)",
        "with_check": null
      },
      {
        "name": "Users can update own posts",
        "cmd": "update",
        "roles": [
          "public"
        ],
        "permissive": "permissive",
        "using": "auth.uid()=user_id",
        "with_check": null
      }
    ],
    "public.profiles": [
      {
        "name": "Authenticated users can insert their own profiles",
        "cmd": "insert",
        "roles": [
          "public"
        ],
        "permissive": "permissive",
        "using": null,
        "with_check": "auth.uid()=id"
      },
      {
        "name": "Public profile shells are readable",
        "cmd": "select",
        "roles": [
          "anon",
          "authenticated"
        ],
        "permissive": "permissive",
        "using": "true",
        "with_check": null
      },
      {
        "name": "Users can update own profile",
        "cmd": "update",
        "roles": [
          "public"
        ],
        "permissive": "permissive",
        "using": "auth.uid()=id",
        "with_check": null
      }
    ],